name,url,description,milestones,team,partner
Aspect Development,NA,Provides component information system software for electronics manufacturers.,Founded 1988; Partnered 1992; Acquired 2000; IPO 1996,Dr. Romesh Wadhwani,NA
Aster Data,http://www.asterdata.com,Fully embeds applications within database engine to enable ultra-fast; deep analysis of massive data sets.,Founded 2005; Partnered 2007; Acquired 2011,Tasso S. Argyros;  Mayank Bawa;  Quentin Gallivan,Doug Leone
Atari,https://twitter.com/atari,Founded in 1972; Atari is the original innovator of video gaming. It owns a portfolio of more than 200 games like Asteroids; Centipede and Pong. ,Founded 1972; Partnered 1975; Acquired 1976,Nolan Bushnell,Donald Valentine
Avanex,http://www.avanex.com,Producer of fiber optic-based photonic processors; which are designed to increase performance of optical networks.,Founded 1997; Partnered 1998; IPO 2000,Simon Cao PhD,NA
Barracuda Networks,http://www.barracuda.com,Barracuda provides security; networking and storage solutions while improving application delivery and network access.,Founded 2003; Partnered 2005; IPO 2013,Dean Drako;  Michael Perone;  Zach Levow,Jim Goetz; Matthew Miller
bebop,https://www.bebop.co/,bebop builds and supports applications that enable people to seamlessly collaborate and accomplish complex tasks together.,Partnered 2015; Acquired 2015,Diane Greene,Jim Goetz
Cafepress,http://www.cafepress.com,Allows people to create; buy; and sell personalized merchandise online using print-on-demand services that reflect their interests.,Founded 1999; Partnered 2005; IPO 2012,Fred Edward Durham III;  Maheesh Jain,Doug Leone
Carbon Black,https://www.carbonblack.com/,Carbon Black provides the most complete solution against attacks targeting organizations’ websites and servers; making it easier for companies to see and stop. ,Founded 2002; Partnered 2012; IPO 2018,Patrick Morley,Matthew Miller
CenterRun Software,NA,CenterRun introduced a product that automates the configuration and deployment of web applications in enterprise data centers from a central console.,Founded 2000; Partnered 2001; Acquired 2003,Aaref Hilaly;  Mike Schroepfer;  Basil Hashem,Michael Moritz; Aaref Hilaly
Cisco,http://www.cisco.com,Cisco was one of the first companies to sell commercially successful routers that support multiple network protocols.,Founded 1984; Partnered 1987; IPO 1990,Len Bosack;  Sandy Lerner,Donald Valentine
Clearwell Systems,http://www.symantec.com/theme.jsp?themeid=clearwell-family,Clearwell Systems changed the way companies perform electronic discovery in response to litigation; regulatory inquiries; and internal investigations.,Founded 2004; Partnered 2005; Acquired 2011,Aaref Hilaly;  Venkat P Rangan;  Charu Rudrakshi,Jim Goetz; Aaref Hilaly
Cortexyme,https://www.cortexyme.com/,Cortexyme is a clinical stage pharmaceutical company developing small molecules to alter the course of Alzheimer’s and other degenerative disorders. Cortexyme is targeting a specific; undisclosed infectious pathogen tied to neurodegeneration and chronic inflammation in humans and animal models. The company’s lead compound; COR388; is the subject of an ongoing phase 1b clinical development program. Additional proprietary small molecules are moving forward in preclinical development. ,Founded 2012; Partnered 2018; IPO 2019,Casey Lynch;  Steve Dominy;  MD;  Kristen Gafric;  JD,Michael Dixon
Cypress,http://www.cypress.com,Develops advanced process-CMOS-integrated circuits for microprocessors and microcontrollers.,Founded 1982; Partnered 1983; IPO 1986,TJ Rodgers,NA
Decolar,http://www.decolar.com,Decolar was the first site in Brazil to offer a single digital destination for flights; hotels; car and property rentals; amusement park passes and travel packages.,Founded 1999; Partnered 2011; IPO 2017,Roberto Souviron,Michael Abramson
Dropbox,http://www.dropbox.com,In 2007 there was nothing like Dropbox. Internet users emailed themselves photos; docs and videos; or saved them to thumb drives. ,Founded 2007; Partnered 2007; IPO 2018,Drew Houston;  Arash Ferdowsi,Bryan Schreier
Electronic Arts,http://www.ea.com,Electronic Arts was a pioneer of the early home computer games industry and was notable for promoting the designers and programmers responsible for its games.,Founded 1982; Partnered 1982; IPO 1989,Trip Hawkins;  John Riccitiello,Donald Valentine
Elevate Credit,http://www.elevate.com/,Elevate's products deliver new levels of access; convenience and value to those who need it most.,Founded 2014; Partnered 2005; IPO 2017,Kenneth Rees,Pat Grady
EndoChoice,http://www.endochoice.com,Founded in 2008; EndoChoice manufactures and sells technology systems; products; devices and services to specialists treating a wide range of gastrointestinal conditions. ,Founded 2007; Partnered 2013,Mark Gilreath,Michael Dixon; Yoav Shaked
Eventbrite,http://www.eventbrite.com,Eventbrite was the first site that allowed anyone to find; create and manage an event.,Founded 2006; Partnered 2009; IPO 2018,Kevin Hartz;  Julia Hartz;  Renaud Visage,Roelof Botha
FireEye,http://www.fireeye.com,Founded in 2004; FireEye brought a fresh perspective to network security and malware protection by using a virtual-machine-based security platform rather than slow; physical machines. ,Founded 2004; Partnered 2004; IPO 2013,David G. DeWalt;  Ashar Aziz,Bill Coughran
First Republic Bank,http://www.firstrepublic.com,Provides private banking; private-business banking; real-estate lending and wealth-management services.,Founded 1985; Partnered 2010; IPO 2010,James Herbert,Michael Moritz; Pat Grady
Flex,http://www.flextronics.com,Provides contract-manufacturing services to equipment manufacturers.,Founded 1969; Partnered 1993; IPO 1994,Mike McNamara,Michael Moritz
FutureAdvisor,https://futureadvisor.com,FutureAdvisor developed a smarter way to manage your stock portfolio. Through its free software; wealth management consultation is now accessible to anyone with a computer.,Founded 2010; Partnered 2010; Acquired 2015,Jon Xu;  Bo Lu,Alfred Lin
GitHub,https://www.github.com,GitHub has built the system of record for code and has emerged as the de facto standard for software development in today’s world.,Founded 2008; Partnered 2015; Acquired 2018,Chris Wanstrath;  PJ Hyett,Jim Goetz; Andrew Reed
Google,http://www.google.com,Google’s founders Larry and Sergey sought to organize the world’s information; and make it universally accessible and useful. The result is Google Search; the world’s most popular way to find information on the web.,Founded 1998; Partnered 1999; IPO 2004,Sergey Brin;  Larry Page,Michael Moritz
Green Dot,https://www.greendot.com/greendot,Largest issuer of reloadable prepaid VISA and MasterCard debit cards.,Founded 1999; Partnered 2003; IPO 2010,Steve Streit,Michael Moritz
Guardant Health,http://www.guardanthealth.com,Guardant Health is a leading precision oncology company focused on helping conquer cancer globally through use its proprietary blood tests; vast data sets and advanced analytics. ,Founded 2012; Partnered 2013; IPO 2018,Helmy Eltoukhy;  AmirAli H. Talasaz;  Michael Wiley,Aaref Hilaly
HubSpot,http://www.hubspot.com,HubSpot does away with the needle-in-the-haystack approach to targeting consumers; allowing companies to manage the vast variety of marketing tools with one centralized system.,Founded 2006; Partnered 2011; IPO 2014,Brian Halligan;  Dharmesh Shah,Pat Grady; Jim Goetz
Humble Bundle,http://www.humblebundle.com,Using a pay-what-you-will model; Humble Bundle offers content to gamers while helping indie developers and charities.,Founded 2010; Partnered 2011,Jeff Rosen;  John Graham,Alfred Lin
Infoblox,http://www.infoblox.com,Delivers Automated Network Control; the fundamental technology that connects end users; devices and networks.,Founded 1999; Partnered 2003; IPO 2012,Robert Thomas;  Stuart Bailey,NA
Inkling,http://www.inkling.com,Inkling is on a mission to transform the way people work. Founded in 2009; Inkling’s mobile platform brings policies and procedures to life for the deskless worker. Employees today expect to go online to find accurate and compelling information on how to do their job; yet employers still ship paper binders or static PDF and Word files. Enterprises use Inkling to deliver policies and procedures in the form of dynamic documents. These documents behave more like consumer apps and engage the user with videos; interactive simulations; dynamic forms and checklists. Employees rely on Inkling to deliver exceptional customer experiences.,Founded 2009; Partnered 2010,Matt MacInnis;  Rob Cromwell,Bryan Schreier
INS,http://www.ins.com,Solved networking issues created by customer implementations of multi-vendor and multi-protocol network solutions.,Founded 1993; Partnered 1993; Acquired 1999; IPO 1996,NA,Doug Leone; Jim Goetz
Instagram,http://instagram.com,Instagram changed the way we share photos and video with our mobile devices. By packaging easy-to-use photo editing with social media; the company has improved the quality of photography the world over.,Founded 2010; Partnered 2012; Acquired 2012,Kevin Systrom;  Mike Krieger,Roelof Botha; Michael Abramson
Isilon Systems,http://www.isilon.com,Develops clustered storage systems in data-intensive markets.,Founded 2001; Partnered 2002; Acquired 2010; IPO 2006,Sujal Patel;  Paul Mikesell,NA
Jasper,https://www.jasper.com,Jasper is a global Internet of Things (IoT) platform. Its SaaS IoT platform enables companies to rapidly and cost-effectively launch; manage; and monetize IoT services on a global scale. ,Founded 2004; Partnered 2005; Acquired 2016,Jahangir Mohammed;  Daniel Collins;  Amit Gupta,Omar Hamoui; Jim Goetz
Jive,http://www.jivesoftware.com,Jive has encouraged and enabled enterprises to communicate and collaborate through its pioneering social business software platform.,Founded 2001; Partnered 2007; IPO 2011,Bill Lynch;  Matt Tucker,Jim Goetz; Pat Grady
KAYAK,http://www.kayak.com,By consolidating search functions for hundreds of travel companies; KAYAK became a one-stop site for booking plane tickets; hotels; cars and travel packages.,Founded 2004; Partnered 2005; Acquired 2013; IPO 2012,Steve Hafner;  Paul English,Michael Moritz
Linear Technology,http://www.linear.com,Manufacturer of analog-integrated circuits.,Founded 1981; Partnered 1981; IPO 1986,Bob Swanson,Donald Valentine
LinkedIn,http://www.linkedin.com,In 2003; LinkedIn launched the social network for professionals; allowing people to connect based on business interactions.,Founded 2002; Partnered 2003; IPO 2011,Reid Hoffman;  Jeff Weiner,Michael Moritz
LitePoint,http://www.litepoint.com,Tests and analyzes wireless devices through development and manufacturing phases.,Founded 2000; Partnered 2007; Acquired 2011,Spiros Bouas;  Benny Madsen;  Christian Olgaard,NA
LSI Logic,http://www.lsilogic.com,Founded in 1981; LSI Logic created advanced custom semiconductors and software to help companies store and distribute their data more efficiently between data centers; mobile networks and client computers.,Founded 1981; Partnered 1981; IPO 1983,Wilf Corrigan;  Abhi Y. Talwalkar,Donald Valentine
MedExpress,http://www.medexpress.com,The mission of MedExpress is to provide a one-stop urgent-care option for unscheduled; timely treatment that isn't quite ER-serious.,Founded 2001; Partnered 2010; Acquired 2015,Frank Alderman,Doug Leone; Michael Dixon
Mellanox,http://www.mellanox.com,Provider of Ethernet and InfiniBand network switches and host bus adapters.,Founded 1999; Partnered 1999; IPO 2007,Eyal Waldman,NA
Meraki,http://www.meraki.com,Meraki offered a complete system of networking products; doing away with market fragmentation; and allowing companies to utilize network connections of the highest speed and quality.,Founded 2006; Partnered 2006; Acquired 2012,Sanjit Biswas;  John Bicket;  Hans Robertson,Doug Leone
Merlin Securities,,Provided prime brokerage software and services to the alternative-investment community.,Founded 2004; Partnered 2007; Acquired 2012,Stephan Vermut;  Aaron Vermut,Pat Grady
Metanautix,http://metanautix.com,Metanautix created the first data compute engine of its kind; helping companies drill down into complex data across various sources; and visualize it in a way that is easily extractable; regardless of differences in network; structure; format or location.,Founded 2012; Partnered 2012; Acquired 2016,Theo Vassilakis,Bill Coughran
Microchip Technology,http://www.microchip.com,Manufacturer of microcontroller; memory; and analog semiconductors.,Founded 1987; Partnered 1989; IPO 1993,Steve Sanghi,Donald Valentine
MobileIron,http://www.mobileiron.com,Through a comprehensive line of mobile apps; MobileIron lets IT administrators manage content on mobile devices across a network.,Founded 2007; Partnered 2008; IPO 2014,Bob Tinker;  Suresh Batchu;  Ajay Mishra,Aaref Hilaly
MongoDB,http://www.mongodb.com/,MongoDB is the leading modern; general purpose database platform; designed to unleash the power of software and data for developers and the applications they build.,Founded 2007; Partnered 2010,Eliot Horowitz;  Dev Ittycheria;  Dwight Merriman,Roelof Botha
Natera,http://www.natera.com,Natera is a genetic testing and diagnostics company that seeks to transform the management of genetic disease through proprietary bioinformatics and molecular technology.,Founded 2004; Partnered 2007,Matthew Rabinowitz;  Jonathan Sheena,Roelof Botha
NetApp,http://www.netapp.com,Computer storage and network data management company.,Founded 1992; Partnered 1994; IPO 1995,Daniel J. Warmenhoven;  David Hitz;  James Lau,Donald Valentine
Netezza,http://www.netezza.com,Simplifies high-performance analytics for business users.,Founded 2000; Partnered 2003; IPO 2007,Jit Saxena,Doug Leone
NetScreen,NA,Offers network/internet security solutions that integrate firewall; VPN encryption and traffic management on a single platform.,Founded 1998; Partnered 1998; Acquired 2004; IPO 2001,Feng Deng;  Yan Ke,NA
Nimble Storage,http://www.nimblestorage.com,Complex infrastructure creates an app-data gap that disrupts data delivery. Closing the app-data gap requires predicting and preventing barriers to data velocity.,Founded 2008; Partnered 2008; IPO 2013,Suresh Vasudevan;  Umesh Maheshwari;  Varun Mehta,Jim Goetz; Matthew Miller
NVIDIA,http://www.nvidia.com,NVIDIA pioneered the art and science of visual computing. Its invention of the GPU transformed the PC from a tool for productivity into one for creativity and discovery.,Founded 1993; Partnered 1993; IPO 1999,Jen-Hsun Huang,NA
Okta,http://www.okta.com,Okta is the foundation for secure connections between people and technology. By harnessing the power of the cloud; Okta allows people to access applications on any device at any time; while still enforcing strong security protections. It integrates directly with an organization’s existing directories and identity systems; as well as 4;000+ applications. Because Okta runs on an integrated platform; organizations can implement the service quickly at large scale and low total cost.,Founded 2009; Partnered 2012; IPO 2017,Todd McKinnon;  Freddy Kerrest,Pat Grady; Matthew Miller
Onyx Pharmaceuticals,,Biopharmaceutical company engaged in the development and commercialization of innovative therapies for cancer patients.,Founded 1992; Partnered 1993; IPO 1996,Frank McCormick,NA
OpenDNS,http://www.opendns.com,OpenDNS is the world’s largest cloud-delivered security platform serving more than 65 million daily users across 160+ countries. Providing a new layer of protection both on and off a company’s network; OpenDNS prevents malicious attacks over any port or protocol. ,Founded 2006; Partnered 2009,David Ulevitch,Pat Grady
Oracle,http://www.oracle.com,For decades; Oracle has engineered integrated hardware and software systems for business; uniting a disjointed digital landscape and creating solutions for the largest companies in the world.,Founded 1977; Partnered 1983; IPO 1986,Larry Ellison,Donald Valentine
Palo Alto Networks,http://www.paloaltonetworks.com,Frustrated with the slow progress of ideas at his employer; Nir Zuk founded Palo Alto Networks to introduce new ways to protect enterprise; government and service providers through better firewalls and stronger network security.,Founded 2005; Partnered 2005; IPO 2012,Nir Zuk;  Rajiv Batra;  Mark McLaughlin,Jim Goetz; Carl Eschenbach
PayPal,http://www.paypal.com,PayPal changed the way we pay for things with its online payment system by letting people pay with their email address. ,Founded 1999; Partnered 1999; Acquired 2002; IPO 2002,Elon Musk;  Max Levchin;  Peter Thiel,Michael Moritz
Peakstream,NA,Peakstream provides a software platform for High Performance Computing that unlocks the power of a new generation of processors; from GPUs to multi-core CPUs.,Partnered 2005; Acquired 2007,Matthew Papakipos,Jim Goetz
Pixelworks,,Semiconductor company formed to develop; market and sell components for flat panel display products.,Founded 1997; Partnered 1998; IPO 2000,Allen Alley,NA
PlanGrid,http://www.plangrid.com,Plangrid’s software brings all your blueprints and construction plans to the cloud; doing away with paper-based markups and getting contractors and architects on the same page for instantaneous collaboration.,Founded 2011; Partnered 2014; Acquired 2018,Ralph Gootee;  Ryan Sutton-Gee;  Tracy Young,Doug Leone
PMC-Sierra,http://www.pmc-sierra.com,Designs; develops; markets and supports high-performance semiconductor networking solutions.,Founded 1984; Partnered 1984; IPO 1991,James V. Diller;  Robert Lee Bailey,Donald Valentine
Progress Software,http://www.progress.com,Develops; markets; and distributes application development; deployment and management technology.,Founded 1981; Partnered 1990; IPO 1991,Joe Alsop,NA
Qualtrics,http://www.qualtrics.com,Qualtrics is a single system of record for all experience data; also called X-data™.,Founded 2002; Partnered 2012; Acquired 2018,Ryan Smith;  Jared Smith;  Scott Smith;  Stuart Orgill,Bryan Schreier; Pat Grady
Quantenna,http://www.quantenna.com,Quantenna’s wireless semiconductors improve wifi networks in the home; enterprise and outdoors. Their industry-leading technology is transforming the way HD video and data streams for homes and businesses.,Founded 2006; Partnered 2006; IPO 2016,Andrea J. Goldsmith;  Sam Heidari,Jim Goetz
Rackspace,http://www.rackspace.com,Provides hosting and cloud computing for businesses.,Founded 1998; Partnered 2000; IPO 2008,Graham M. Weston;  Lanham Napier;  Patrick Condon,Doug Leone
Redback Networks,,Networking system that enables carriers; cable operators and service providers to deploy high-speed internet access.,Founded 1996; Partnered 1996; IPO 1999,Gaurav Garg,NA
RingCentral,http://www.ringcentral.com,RingCentral created a cloud-based solution for physical phone systems in the business world; which had become outdated and expensive to maintain. ,Founded 1998; Partnered 2006; IPO 2013,Vlad Shmunis,Doug Leone
Ruckus Wireless,http://www.ruckuswireless.com,Ruckus Wireless is a pioneer in the wireless infrastructure market; with a focus on building a smarter; more reliable WiFi signal.,Founded 2004; Partnered 2002; IPO 2012,Selina Lo;  William Kish;  Victor Shtrom,Jim Goetz
Saba Software,http://www.saba.com,Saba Software develops; markets and supports a complete web-based self-service application suite.,Founded 1997; Partnered 1998; IPO 2000,Bobby Yazdani,Michael Moritz
ServiceNow,http://www.servicenow.com/,ServiceNow was born because founder Fred Luddy was frustrated that software at home was so useful and fun; yet software at work was so clumsy.,Founded 2003; Partnered 2009; IPO 2012,Fred Luddy;  Frank Slootman,Doug Leone; Pat Grady
SimpliSafe,http://simplisafe.com/,SimpliSafe was started to help people live safely with a DIY home security system anyone can use—ending the alarm industry’s grip on consumers with high-priced upgrades and long term contracts.,Founded 2006; Partnered 2014; Acquired 2019,Chad Laurans,Matthew Miller
Skyhigh Networks,http://www.skyhighnetworks.com,As more and more industries join the cloud; Skyhigh Networks is helping maintain security and compliance by shining a light on shadow IT.,Founded 2011; Partnered 2013,Rajiv Gupta;  Sekhar Sarukkai;  Kaushik Narayan,Aaref Hilaly; Matthew Miller
Skyscanner,http://www.skyscanner.com/,Skyscanner is the world's travel search engine; created in 2003 as a way to compare airline fares; after the founder was frustrated having to visit different sites to find the best price.,Founded 2001; Partnered 2013,Gareth Williams;  Bonamy Grimes,Michael Moritz
Sourcefire,http://www.sourcefire.com,World leader in intelligent security monitoring and threat-management solutions,Founded 2001; Partnered 2004; IPO 2007,Martin Roesch;  John Burris,NA
Springpath,http://www.springpathinc.com/,For many companies; data is stuck in silos; but Springpath introduces the first software-only data platform that uses a patent-pending architecture to store; manage and secure data in one place.,Founded 2012; Partnered 2012,Krishna Yadappanavar;  Mallik Mahalingam,Jim Goetz
Square,https://www.squareup.com,With its combination of intuitive software and beautifully designed hardware; Square is a Swiss army knife for businesses of any size; covering everything from payment and point-of-sale to financial services.,Founded 2009; Partnered 2011; IPO 2015,Jack Dorsey;  Jim McKelvey,Roelof Botha
Sunrun,http://www.sunrun.com,Sunrun began with the idea that simple; affordable solar power could be a reality for consumers. Ending decades of dependence on power companies; Sunrun has a revolutionary model that allows people to use solar power without actually purchasing and maintaining the panels.,Founded 2007; Partnered 2010,Edward Fenster;  Lynn Jurich,Pat Grady
Symantec,http://www.symantec.com,Founded in 1982 by computer scientists; Symantec focuses on security and management of data; ensuring both businesses and consumers stay protected against risks.,Founded 1982; Partnered 1983; IPO 1989,NA,NA
Trulia,http://www.trulia.com,Trulia is an all-in-one real estate site that gives the local scoop about homes for sale; apartments for rent; neighborhood insights; and real estate markets and trends to help visitors figure out exactly what; where; and when to buy; sell; or rent. ,Founded 2005; Partnered 2007; IPO 2012,Peter Flint;  Sami Inkinen,Bryan Schreier
Tumblr,http://www.tumblr.com,Founded in 2007; Tumblr set out to give creatives a functional; free and versatile way to share their favorite content with an emphasis on visuals and multimedia.,Founded 2007; Partnered 2010; Acquired 2013,David Karp,Roelof Botha
VA Linux/SourceForge,,Provider of collaborative software development platform.,Founded 1993; Partnered 1998; IPO 1999,NA,Doug Leone
Viptela,http://www.viptela.com,Viptela is transforming how Fortune 500 companies build and secure their end-to-end network infrastructure by simplifying architectures and eliminating needless inefficiencies faced by the enterprise. ,Founded 2012; Partnered 2012,Amir Khan;  Khalid Raza,Bill Coughran
Virident Systems,http://www.virident.com,Builds enterprise-class solutions based on Flash and other storage-class memories.,Founded 2006; Partnered 2010; Acquired 2013,Kumar Ganapathy;  Vijay Karamcheti;  Michael Gustafson,NA
Wavefront,https://www.wavefront.com/,Wavefront is a hosted platform for ingesting; storing; visualizing and alerting on metric data. It is based on a stream processing approach invented at Google which allows engineers to manipulate metric data with unparalleled power.,Founded 2013; Partnered 2014; Acquired 2017,Sam Pullara;  Dev Nag;  Clement Pang;  Durren Shen,Bill Coughran
Weebly,http://www.weebly.com,Founded in 2006; Weebly was the first user-friendly; drag-and-drop website builder. The webhosting service allowed people to easily build personal websites and online portfolios without having to know how to code.,Founded 2006; Partnered 2011,David Rusenko;  Dan Veltri;  Chris Fanini,Roelof Botha
WhatsApp,http://www.whatsapp.com,WhatsApp Messenger is a cross-platform mobile messaging app that allows you to exchange messages without having to pay for SMS usage. By using the same internet data plan that you use for email and web browsing; there is no cost to message and stay in touch with your friends across the globe.,Founded 2009; Partnered 2011; Acquired 2014,Brian Acton;  Jan Koum,Jim Goetz; Michael Abramson
Xoom,http://www.xoom.com,Founded in 2001; Xoom offers a convenient and cost-effective way to transfer money to other countries. ,Founded 2001; Partnered 2003; IPO 2013,John Kunze;  Kevin Hartz,Roelof Botha
Yahoo!,http://www.yahoo.com,Founded in 1994; Yahoo! began as a guide to the World Wide Web—a web portal with an organized directory of websites.,Founded 1994; Partnered 1995; IPO 1996,David Filo;  Jerry Yang,Michael Moritz
YouTube,http://www.youtube.com,Since 2005; YouTube has made uploading and sharing videos with family; friends and the entire world completely effortless. ,Founded 2005; Partnered 2005; Acquired 2006,Chad Hurley;  Steve Chen;  Jawed Karim,Roelof Botha
Zappos,http://www.zappos.com/about.zhtml,In 1999; Nick Swinmurn founded Zappos.com to improve the shoe-shopping experience through superior product selection and customer service.,Founded 1999; Partnered 2004; Acquired 2009,Tony Hsieh;  Nick Swinmurn,Michael Moritz; Alfred Lin
ZirMed,https://public.zirmed.com,ZirMed pioneered cloud-based medical claims management; streamlining outdated reimbursement workflows and transforming the way providers manage fee-for-service business performance.,Founded 1999; Partnered 2009; Acquired 2017,Thomas W. Butts,Doug Leone
