name,url,description,milestones,team,partner
100 Thieves,https://www.100thieves.com/,"100 Thieves (“Hundred Thieves”) is a Los Angeles; CA-based lifestyle; apparel; and esports organization founded by former Call of Duty world champion and YouTube sensation Matthew ""Nadeshot"" Haag.  The brand has teams competing in League of Legends; Fortnite; Call of Duty; and Clash Royale. 100 Thieves earned first place in the North America League of Legends Championship Series (NALCS) Spring Regular Season and represented North America at the 2018 World Championships in South Korea.  They are the fastest growing esports channel on YouTube.",Founded 2016; Partnered 2018,Matthew Haag;  John Robinson,Stephanie Zhan
23andMe,https://www.23andme.com/,23andMe is the leading personal genetics company dedicated to helping individuals understand their own genetic information through DNA analysis technologies and web-based interactive tools. The company is a web-based service that helps consumers understand what their DNA says about their health; traits and ancestry.,Founded 2006; Partnered 2017,Anne Wojcicki,Roelof Botha
[24]7.ai,https://www.247.ai/,[24]7.ai helps businesses attract and retain customers; and make it possible to create a personalized; predictive and effortless customer experience.,Founded 2000; Partnered 2003,"Shanmugam ""Nags"" Nagarajan;  P V Kannan",Michael Moritz
ActionIQ,http://www.actioniq.co/,ActionIQ is developing the next generation of distributed data engines. It lives in the cloud; manages itself; and scales to billions of historical events. It utilizes latest hardware trends; massive parallelism and computes results orders of magnitude faster than state-of-the-art databases.,Founded 2014; Partnered 2014,Tasso Argyros;  David Todrin,Doug Leone
Against Gravity,https://www.againstgrav.com/,Against Gravity is an augmented and virtual reality software company.,Founded 2016; Partnered 2016,Nick Fajt;  Cameron Brown;  Bilal Orhan;  Dan Kroymann;  John Bevis;  Josh Wehrly,Stephanie Zhan
AgilOne,http://www.agilone.com,AgileOne bridges the gap between big data; consumer insights and execution into one solution for marketers.,Founded 2005; Partnered 2011,Omer Artun,Bryan Schreier
Airbnb,http://www.airbnb.com,One of the first companies to usher in the sharing economy; Airbnb connects people around the world with unique homes and unforgettable experiences.,Founded 2007; Partnered 2009,Nathan Blecharczyk;  Brian Chesky;  Joe Gebbia,Alfred Lin; Michael Abramson
AirStrip,http://www.airstriptech.com,Airstrip Technologies developed medical software to deliver real time; critical patient data to the mobile devices of those who need it most. ,Founded 2004; Partnered 2010,Cameron Powell;  Alan Portela;  Trey Moore,Michael Dixon
Ameritox,http://www.ameritox.com,Ameritox is the nation’s leader in pain medication monitoring; offering laboratory services and practice management tools to help clinicians coordinate and optimize the care of chronic pain patients. ,Founded 1996; Partnered 2007,A. Scott Walton,NA
Amplitude,https://amplitude.com/,Amplitude helps product teams rapidly build digital products that work better for the customer and grow their business.,Founded 2012; Partnered 2018,NA,Pat Grady; Sonya Huang
App Annie,http://www.appannie.com,"App Annie helps businesses do ""The Math Behind the App Stores"" with rankings; analytics; and market intelligence for all the leading app stores.",Founded 2010; Partnered 2013,Bertrand Schmitt,Omar Hamoui
Armis,https://armis.com/,Armis is the first agentless; enterprise-class security platform to address the new threat landscape of unmanaged and IoT devices. Our mission is to let companies adopt these new types of connected devices without fear of compromise by cyber attack.,Founded 2015; Partnered 2015,Yevgeny Dibrov;  Nadir Izrael,Gili Raanan; Carl Eschenbach; Sonya Huang
Assurex Health,http://www.assurexhealth.com,Assurex Health helps physicians determine the right medication for patients; using pharmacogenomics—the study of the genetic factors that influence an individual's response to drug treatments.,Founded 2006; Partnered 2011; Acquired 2016,James S. Burns;  Gina Drosos;  Donald Wright,NA
Athelas,https://athelas.com/,Instant; at-home blood diagnostics for oncology care.,Founded 2016; Partnered 2016,Tanay Tandon;  Deepika Bodapati,Alfred Lin; Liu Jiang
Aurora,https://aurora.tech/,Aurora is catalyzing the self-driving revolution by solving today’s most complex AI; automation and engineering challenges.,Founded 2016; Partnered 2019,Chris Urmson;  Sterling Anderson;  Drew Bagnell,Carl Eschenbach; Amy Sun
Barefoot Networks,http://barefootnetworks.com/,As Ethernet switch chips rise in demand; Barefoot Networks is innovating new ways to compete in the promising market by offering bare-metal switching to networking companies.,Founded 2013; Partnered 2014; Acquired 2019,Martin Izzard,Bill Coughran
Berkeley Lights,https://www.berkeleylights.com/,Berkeley Lights has brought to market a novel technology for single cell identification; measurement and manipulation aiming to revolutionize biopharma; diagnostics and life science research.,Founded 2011; Partnered 2015,Eric Hobbs,Michael Moritz
Bird,https://www.bird.co/,"Bird is an electric vehicle sharing company dedicated to bringing affordable; environmentally-friendly transportation solutions to communities across the world. It provides a fleet of shared electric scooters that can be accessed via smartphones. Birds give people looking to take a short journey across town or down that ""last-mile"" from the subway or bus to their destination in a way that does not pollute the air or add to traffic. ",Founded 2017; Partnered 2018,Travis VanderZanden,Roelof Botha; Andrew Reed
Blue Danube Systems,http://www.bluedanubelabs.com,Blue Danube Systems designed a mobile wireless solution that significantly and cost-effectively increases network capacity and enhances quality of service. ,Founded 2006; Partnered 2013,Mark Pinto,Bill Coughran
BridgeBio,https://bridgebio.com/,BridgeBio finds; develops; and delivers breakthrough medicines for genetic diseases. They have built a portfolio of more than 15 transformative drugs ranging from pre-clinical to late stage development in multiple therapeutic areas including genetic dermatology; oncology; cardiology; neurology; endocrinology; renal disease; and ophthalmology. The company’s focus on scientific excellence and rapid execution aims to translate today's discoveries into tomorrow's medicines.,Founded 2014; Partnered 2018,Neil Kumar,Roelof Botha; Michael Dixon
Brud,http://www.http://www.brud.fyi,Brud is a transmedia studio that creates digital character driven story worlds.,Partnered 2016,Trevor McFedries;  Sara DeCou,Stephanie Zhan
Carbon,http://carbon3d.com/,Through a process called “light extrusion;” Carbon is transforming 3D printing—moving beyond basic prototyping to 3D manufacturing and delivering previously impossible materials at over 100 times the speed. ,Founded 2013; Partnered 2013,Joe DeSimone;  Rob Schoeben;  Craig Carlson;  Alex Ermoshkin;  Jason Rolland,Jim Goetz
CEGX,http://www.cambridge-epigenetix.com/,Cambridge Epigenetix (CEGX) aims to change the way medicine is practised by reducing several routine and important diagnostic screening tests to a simple blood draw using the power of epigenetics. Epigenetics is the way genes are switched on or off (“expressed”); without altering the genes themselves; due to the presence of small chemicals around DNA or its surrounding proteins.,Partnered 2015,Dr Jason Mellad,Roelof Botha
Charlotte Tilbury,http://www.charlottetilbury.com/us/,Founded by world renown make-up artist Charlotte Tilbury; Charlotte Tilbury Beauty is revolutionizing make-up with easy to choose; easy to use and easy to gift skincare and color products.,Founded 2013; Partnered 2017,Charlotte Tilbury,Michael Moritz
Chartboost,http://www.chartboost.com,Founded by game developers and data geeks; Chartboost builds technology for people just like them; so they can turn their mobile games into successful businesses.,Founded 2011; Partnered 2012,Maria Alegre;  Sean Fannan,Jim Goetz; Michael Abramson
Citizen,http://www.citizen.com/,Citizen’s mission is to ‘Protect the World.’ Today; they do that through a free mobile application that keeps people safe and informed about local crime and incidents in their area.,Founded 2015; Partnered 2017,Andrew Frame;  JD Maresco;  Luis Samaniego,Mike Vernal
Clari,http://clari.com/,Clari makes selling just about anything easier by combining data science; advanced analytics; mobile and cloud technology.,Founded 2012; Partnered 2012,Venkat P Rangan;  Andy Byrne,Aaref Hilaly
Clever,http://clever.com,Schools call Clever a game changer because it makes using a school's technology faster and simpler for teachers and students.,Founded 2012; Partnered 2013,Tyler Bosmeny;  Dan Carroll;  Rafael Garcia,Bryan Schreier
Clickatell,http://www.clickatell.com,In 2000; Clickatell was founded to address a need in South Africa for an SMS provider that could enable the sending of multiple texts to different countries from a single website.,Founded 2000; Partnered 2007,Pieter De Villiers;  Casper De Villiers;  Patrick Lawson,NA
Clover Health,https://cloverhealth.com/,Clover Health is a unique health insurance plan focused on driving down costs and producing improved health outcomes. Clover uses sophisticated analytics and custom software to direct their own clinical staff to proactively fill in gaps in the care of their members. Clover has a proven model they're scaling out.,Founded 2014; Partnered 2015,Vivek Garipalli;  Kris Gale,Michael Dixon
Clutter,https://www.clutter.io,Clutter helps relieve stress from major life events. The company's full-service storage service allows consumers to safely and affordably store their belongings without lifting a finger.,Founded 2013; Partnered 2015,Ari Mir;  Brian Thomas,Omar Hamoui
Cobalt Robotics,https://cobaltrobotics.com/,Cobalt’s Security Service combines advances in autonomous cars; machine learning; anomaly detection; and 2-way telepresence. This allows a remote guard to be in many locations at once— providing high-level human intelligence; rapid situational awareness; real-time responsiveness; and perfect accountability.,Founded 2016; Partnered 2018,Travis Deyle;  Erik Schluntz,Alfred Lin
Cohesity,http://www.cohesity.com/,Cohesity is in the business of building and selling the next generation of secondary storage appliances.,Founded 2013; Partnered 2013,Mohit Aron,Bill Coughran; Carl Eschenbach
Comprehend,http://www.comprehend.com,Comprehend Systems creates SaaS tools that help understand; explore; and analyze data across multiple; disparate data sources. Comprehend Systems' first product; Comprehend Clinical; was created to improve and accelerate clinical trials to bring new; safer treatments to market sooner.,Founded 2010; Partnered 2013,Rick Morrison;  Jud Gardner,Michael Dixon
Confluent,https://www.confluent.io/,Confluent was founded by the team that built Apache Kafka™ at LinkedIn and that scaled Kafka to accommodate over 1 trillion messages per day – covering everything happening in a company.,Founded 2014; Partnered 2017,Jay Kreps;  Neha Narkhede;  Jun Rao,Matthew Miller
Crew,https://crewapp.com/,Crew is a messaging app that's geared towards workers who don't sit in front of a computer for work. Similar to how Slack has helped workers in the information economy; Crew provides a single way for employees and managers to communicate using the phones they already have. ,Founded 2015; Partnered 2016,Daniel Leffel;  Broc Miramontes,NA
Cumulus Networks,http://www.cumulusnetworks.com,Cumulus Networks enables high-capacity networks and architectures that are affordable and easy to deploy.,Founded 2009; Partnered 2013,JR Rivers;  Nolan Leake,NA
Dashlane,https://www.dashlane.com/,Dashlane simplifies and secures your digital identity across all platforms and devices. The Dashlane app automatically fills and stores passwords; personal data; and payment details and includes a suite of tools to help you manage; monitor; and protect your digital identity. Available in 11 languages and trusted by 11+ million people in 180 countries; it's the complete; global solution for living safely and seamlessly online.,Founded 2009; Partnered 2019,Emmanuel Schalit;  Guillaume Maron;  Jean Guillou,Jim Goetz; Sonya Huang
Dia&Co,https://www.dia.com/,Dia&Co an online shopping experience for women who wear size 14+. The company's flagship product is a personal styling service that allows customers to shop from the comfort of their homes. By developing a new kind of relationship with customers; Dia is resolving decades of inefficiencies in plus-size shopping. ,Founded 2014; Partnered 2016,Nadia Boujarwah;  Lydia Gilbert,Alfred Lin; Jess Lee
Docker,http://www.docker.com,Docker is pioneering the “containerization” of apps within the enterprise. It is built on an open source platform for developers of distributed applications.,Founded 2010; Partnered 2014,Ben Golub;  Solomon Hykes,Matthew Miller; Bill Coughran
Domino Data Lab,https://www.dominodatalab.com/,Domino was founded by three veterans of the finance industry; to help leading organizations develop better medicines; grow more productive crops; build better cars; or simply recommend the best song to play next. Their mission is to help data scientists across industries develop and deploy ideas faster with collaborative; reusable; reproducible analysis.,Founded 2016; Partnered 2016,Nick Elprin; Chris Yang; Matthew Granade,Bryan Schreier
DoorDash,http://www.doordash.com,Founded in 2013 in a dorm room at Stanford; DoorDash began with a mission to deliver local products to people online.,Founded 2013; Partnered 2014,Tony Xu;  Stanley Tang;  Andy Fang,Alfred Lin; Michael Abramson
Drawbridge,http://drawbridge.com/,Drawbridge is the leader in identity resolution that helps customer-obsessed companies connect; unify; and supercharge their data to deliver unparalleled experiences with unmatched clarity. Drawbridge uses large-scale AI and machine learning technologies to build democratized solutions for identity to power martech; customer experience; and security applications.,Founded 2010; Partnered 2010; Acquired 2019,Kamakshi Sivaramakrishnan,Jim Goetz
Drift,https://www.drift.com/,Drift is the world’s leading conversational marketing platform. ,Founded 2014; Partnered 2017,David Cancel;  Elias Torres,Pat Grady
Druva,http://www.druva.com/,Druva is a leading provider of continuous data protection and disaster recovery solutions.,Founded 2007; Partnered 2010,Jaspreet Singh,Shailendra Singh
Elevate,http://elevateapp.com,Elevate is a new type of cognitive training tool designed to build communication and analytical skills. ,Founded 2014; Partnered 2012,Jesse Pickard,Bryan Schreier
Embark Trucks,https://embarktrucks.com/,Embark Trucks is developing self-driving semi trucks. Their team is made up of robotics specialists with deep expertise in artificial intelligence; machine learning; and real-world deployment of advanced technology. Embark Trucks' autonomous fleet leverages this leading technology to help address rising shipping costs due to the shortage of drivers for long-haul trips. ,Founded 2016; Partnered 2018,Alex Rodrigues;  Brandon Moak,Pat Grady
Ethos,https://www.getethos.com/,Ethos is a next generation life insurance company that transforms the policy-buying experience by making it self-serve and instantaneous; whether online or on mobile.,Founded 2016; Partnered 2017,Peter Colis;  Lingke Wang,Roelof Botha; Stephanie Zhan
Evernote,http://www.evernote.com,Evernote brings your life's work together in one digital workspace for storing and sharing. As one workspace that lives across your phone; tablet; and computer; Evernote is the place you write free from distraction; collect information; find what you need; and present your ideas to the world. ,Founded 2007; Partnered 2010,Phil Libin;  Chris O'Neill;  Stepan Pachikov,Roelof Botha
Everwise,https://www.geteverwise.com/,Everwise exists to solve an acute challenge – providing highly motivated professionals with the opportunities they uniquely need to be successful throughout their careers.,Founded 2013; Partnered 2015,Ian Gover;  Colin Schiller;  Michael Bergelson,NA
Faire,https://www.faire.com/,Faire is revolutionizing the way retailers shop for their stores by taking all the pain out of the buying process. Store owners can come to Faire to get product recommendations from hundreds of brands all in one place.,Founded 2016; Partnered 2017,Max Rhodes;  Daniel Perito;  Marcel Cortes,Alfred Lin
Figma,https://www.figma.com/,Figma is the first web-based collaborative design tool. Multiple people can jump in a file at the same time; so they can design; prototype; copy code and gather feedback all in one place. Figma has simplified the design process for teams of designers; developers; product managers; marketers and others at thousands of companies including Uber; Square; Twitter and GitHub.,Founded 2012; Partnered 2019,Dylan Field;  Evan Wallace,Andrew Reed
Front,https://frontapp.com/,Front redefines work communication with the first shared inbox for teams. By unifying email; customer communication channels; and apps in one delightful platform; Front helps teams collaborate transparently; and work faster and better together.,Founded 2013; Partnered 2017,Mathilde Collin;  Laurent Perrin,Bryan Schreier; Andrew Reed
GameFly,http://gamefly.com,GameFly uses a monthly subscription model for game consoles and handhelds that saves gamers the hassle of finding and playing games that don't appeal to them. ,Founded 2002; Partnered 2002,Sean Spector;  Dave Hodess,Michael Moritz
GenEdit,http://www.genedit.com/,GenEdit was founded to transform the delivery of gene therapies and enable the next generation of non-viral; gene editing-based therapeutics. GenEdit’s technology platform solves current delivery challenges by systematically screening its proprietary nanoparticle library and providing safer and efficient delivery to target tissues. GenEdit’s proprietary nanoparticles has broad applicability including the development of CRISPR-based therapeutics and gene therapy products for a wide range of genetic diseases.,Founded 2016; Partnered 2016,Kunwoo Lee;  Hyo Min Park;  Niren Murthy,Roelof Botha
Glossier,https://www.glossier.com/,Founded in 2014; Glossier Inc. is building the future beauty company in collaboration with its customers. With products inspired by the people who use them and a mission to give voice through beauty; Glossier celebrates individuality and personal choice.,Founded 2014; Partnered 2019,Emily Weiss,Michael Abramson; Sonya Huang
Good Eggs,http://www.goodeggs.com,Good Eggs makes it easy for busy people to eat well at home by curating a marketplace full of the best local; organic produce; sustainable meat and fish; and delicious grocery staples.,Founded 2011; Partnered 2013,Bentley Hall;  Alon Salant,Bryan Schreier
Graphcore,https://www.graphcore.ai/,Graphcore has designed a new processor specifically for machine learning - the intelligence processing unit (IPU) to let innovators create next generation machine intelligence.,Founded 2016; Partnered 2017,Nigel Toon;  Simon Knowles,Matthew Miller; Bill Coughran; Stephanie Zhan
Hayneedle,http://www.hayneedle.com,A collection of online stores that offers the largest selection of great specialty products at prices that fit within most any budget. Starting out as hammocks.com; Hayneedle has grown to become the one of the world’s largest home furnishings online retailers. ,Founded 2002; Partnered 2006,Doug Nielsen;  Mark Hasebroock,NA
Health Catalyst,http://www.healthcatalyst.com,Health Catalyst redefined analytics for hospitals and how they handle data unique to medicine. By determining normal data modeling was not the best fit for medical offices; Health Catalyst identified a crucial starting point for improving healthcare.,Founded 2008; Partnered 2011,Daniel Burton;  Steve Barlow;  Brent Dover,Michael Dixon
Hearsay Systems,https://hearsaysystems.com,Hearsay helps modernize traditional sales organizations by getting them tuned into social media. ,Founded 2009; Partnered 2010,Clara Shih;  Steve Garrity,Bryan Schreier
HireVue,http://www.hirevue.com,HireVue provides a video intelligence platform that utilizes video interviewing and pre-hire assessment to help global enterprises gain a competitive advantage in the modern talent marketplace to deliver a transformational hiring process.,Founded 2004; Partnered 2013,Kevin Parker;  Loren Larsen,Matthew Miller
Houseparty,https://joinhouse.party/,Houseparty allows users to quickly jump into “parties” of up to 8 people simultaneously; creating drop-in-drop-out style video chats between any friends who are online at the same time.,Founded 2012; Partnered 2016; Acquired 2019,Ben Rubin;  Itai Danino;  Sima Sistani,Mike Vernal
Houzz,http://www.houzz.com,A marketplace of homeowners and home professionals; Houzz is the best way to get inspired; discover products and to find and collaborate with the perfect architect; designer or contractor.,Founded 2009; Partnered 2011,Adi Tatarko;  Alon Cohen,Alfred Lin
Inside.com,http://www.inside.com/,Inside.com changes the way we read news on mobile devices by offering a short; engaging jump-off point into a curated feed of timely articles from reputable publications.,Founded 2007; Partnered 2006,Jason Calacanis,Roelof Botha
Instacart,http://instacart.com,Instacart seeks to build the best way for people anywhere in the world to shop for groceries and have them delivered instantly.,Founded 2012; Partnered 2013,Apoorva Mehta;  Max Mullen;  Brandon Leonardo,Michael Moritz; Alfred Lin; Michael Abramson
IPG,http://www.ipg.com/,IPG collaborates with health plans in partnership with providers; physicians; manufacturers and patients to develop market-based solutions that deliver tangible value in the implantable Device Benefit Management space.,Founded 2004; Partnered 2010,Vince Coppola,Michael Dixon
Ironclad,https://ironcladapp.com/,Ironclad builds contract solutions for creating; automating and tracking contracts; empowering legal teams to do more legal work; less paperwork. ,Founded 2014; Partnered 2018,Jason Boehmig;  Cai GoGwilt,Jess Lee
Jawbone,http://www.jawbone.com,A pioneer in Bluetooth technology; Jawbone makes discreet; wireless wearable devices.,Founded 1999; Partnered 2007,Hosain Rahman;  Alex Asseily,NA
Kahuna,http://www.usekahuna.com/,Kahuna invented the world’s first customer engagement engine dedicated to targeting and delighting customers of all demographics.,Founded 2012; Partnered 2014,Adam Marchick;  Jacob Taylor,Omar Hamoui
Kenshoo,http://www.kenshoo.com,Kenshoo is the global leader in agile marketing; developing award-winning technology that powers digital marketing campaigns for nearly half of the Fortune 50 and all 10 top global ad agency networks. ,Founded 2006; Partnered 2007,Yoav Izhar-Prato;  Alon Sheafer;  Nir Cohen,Shmil Levy
Kiwi,http://www.kiwiup.com,Kiwi saw a gap in the amount of games being developed for Android as an opportunity to excel and create entertainment apps built for the entire gaming market.,Founded 2011; Partnered 2011,Omar Siddiqui;  Shvetank Jain,Alfred Lin; Omar Hamoui
Klarna,http://www.klarna.com,Klarna gives customers the simplest buying experience and companies amazing checkout rates.,Founded 2005; Partnered 2010,Sebastian Siemiatkowski;  Victor Jacobsson;  Niklas Adalberth,Michael Moritz; Michael Abramson
Lattice Engines,http://www.lattice-engines.com,Lattice is pioneering predictive marketing through intelligent applications and highly specific campaign options that make complex data science easy to use.,Founded 2005; Partnered 2011,Shashi Upadhyay,Doug Leone
Lifecode,http://lifecodehealth.com/,Starting with an oncology focus; Lifecode is committed to improving the lives of patients through interpretation and architecture of genomic medicine.,Founded 2011; Partnered 2011,NA,NA
LightStep,http://lightstep.com/,LightStep is rethinking observability in the emerging world of microservices and high concurrency. LightStep's first product enables developers and devops to trace individual requests through complex systems with incredibly high fidelity.,Founded 2015; Partnered 2017,Ben Sigelman;  Ben Cronin;  Daniel Spoonhower,Aaref Hilaly
Lilt,https://lilt.com/,Lilt helps companies be first to emerging markets by offering a complete; high-quality solution for enterprise translation. By offering the first machine translation engine that continuously learns from human feedback; Lilt helps enterprises increase translation quality and speed without spiking costs.,Founded 2015,Spence Green;  John DeNero,Bill Coughran; Liu Jiang
Limbix,https://www.limbix.com/,Limbix provides Virtual Reality and digital therapeutic tools to help therapists provide more effective mental healthcare.,Founded 2016; Partnered 2016,Ben Lewis;  Tony Hsieh,NA
Luminate,http://www.luminatewireless.com/,Luminate enables mobile operators by transforming the ways in which they create networks and services.,Founded 2013; Partnered 2013,Murari Srinivasan;  Kevin Yu,Bill Coughran
Mapillary,https://www.mapillary.com/,Mapillary is a passionate community of people who want to make the world accessible to everyone by creating a photo representation of the world. Anyone can join the community and collect street level photos by using simple tools like smartphones or action cameras.,Founded 2013; Partnered 2014,Jan Erik Solem,Roelof Botha
MarkLogic,http://www.marklogic.com,Due to the increasing demands of housing big data; MarkLogic provides solutions by offering flexible and extensive databases for enterprises that are easy to integrate; search and manage.,Founded 2001; Partnered 2002,Christopher Lindblad;  Gary L. Bloom,Pat Grady
