name,url,description,milestones,team,partner
Zoom,https://zoom.us/,Zoom unifies cloud video conferencing; simple online meetings; group messaging; and a software-defined conference room solution into one easy-to-use platform. Zoom's solution offers the best video; audio; and wireless screen-sharing experience across Windows; Mac; Linux; Chrome OS; iOS; Android; Blackberry; Zoom Rooms; and H.323/SIP room systems. Founded in 2011; Zoom's mission is to make video and web conferencing frictionless.,Partnered 2016; IPO 2019,Eric Yuan,Carl Eschenbach; Pat Grady
100 Thieves,https://www.100thieves.com/,"100 Thieves (“Hundred Thieves”) is a Los Angeles; CA-based lifestyle; apparel; and esports organization founded by former Call of Duty world champion and YouTube sensation Matthew ""Nadeshot"" Haag.  The brand has teams competing in League of Legends; Fortnite; Call of Duty; and Clash Royale. 100 Thieves earned first place in the North America League of Legends Championship Series (NALCS) Spring Regular Season and represented North America at the 2018 World Championships in South Korea.  They are the fastest growing esports channel on YouTube.",Founded 2016; Partnered 2018,Matthew Haag;  John Robinson,Stephanie Zhan
23andMe,https://www.23andme.com/,23andMe is the leading personal genetics company dedicated to helping individuals understand their own genetic information through DNA analysis technologies and web-based interactive tools. The company is a web-based service that helps consumers understand what their DNA says about their health; traits and ancestry.,Founded 2006; Partnered 2017,Anne Wojcicki,Roelof Botha
3Com,http://www.3com.com,3Com was an early provider of network infrastructure products; focusing on deploying Ethernet technology. It achieved a leading market presence in China with significant market share throughout the rest of the world.,Founded 1979; Partnered 1982; IPO 1984,Robert Metcalfe;  Robert Mao,NA
[24]7.ai,https://www.247.ai/,[24]7.ai helps businesses attract and retain customers; and make it possible to create a personalized; predictive and effortless customer experience.,Founded 2000; Partnered 2003,"Shanmugam ""Nags"" Nagarajan;  P V Kannan",Michael Moritz
ActionIQ,http://www.actioniq.co/,ActionIQ is developing the next generation of distributed data engines. It lives in the cloud; manages itself; and scales to billions of historical events. It utilizes latest hardware trends; massive parallelism and computes results orders of magnitude faster than state-of-the-art databases.,Founded 2014; Partnered 2014,Tasso Argyros;  David Todrin,Doug Leone
AdMob,http://www.admob.com,By ignoring carriers and focusing entirely on developers; AdMob created a pay-per click advertising marketplace for mobile apps. ,Founded 2006; Partnered 2006; Acquired 2010,Omar Hamoui,Jim Goetz
Against Gravity,https://www.againstgrav.com/,Against Gravity is an augmented and virtual reality software company.,Founded 2016; Partnered 2016,Nick Fajt;  Cameron Brown;  Bilal Orhan;  Dan Kroymann;  John Bevis;  Josh Wehrly,Stephanie Zhan
Agile Software,http://www.agile.com,Agile Software provides product content management software solutions for e-supply chains.,Founded 1995; Partnered 1996; IPO 1999,Bryan Stolle,Michael Moritz
AgilOne,http://www.agilone.com,AgileOne bridges the gap between big data; consumer insights and execution into one solution for marketers.,Founded 2005; Partnered 2011,Omer Artun,Bryan Schreier
Airbnb,http://www.airbnb.com,One of the first companies to usher in the sharing economy; Airbnb connects people around the world with unique homes and unforgettable experiences.,Founded 2007; Partnered 2009,Nathan Blecharczyk;  Brian Chesky;  Joe Gebbia,Alfred Lin; Michael Abramson
AirStrip,http://www.airstriptech.com,Airstrip Technologies developed medical software to deliver real time; critical patient data to the mobile devices of those who need it most. ,Founded 2004; Partnered 2010,Cameron Powell;  Alan Portela;  Trey Moore,Michael Dixon
Altiscale,https://www.altiscale.com/,Altiscale created the first management service built for Apache Hadoop; an open-source; data storage system.,Founded 2012; Partnered 2012; Acquired 2016,Raymond Stata,Bill Coughran
AMCC,http://www.amcc.com,Manufactures high-performance integrated circuits.,Founded 1979; Partnered 1987; IPO 1997,NA,NA
Ameritox,http://www.ameritox.com,Ameritox is the nation’s leader in pain medication monitoring; offering laboratory services and practice management tools to help clinicians coordinate and optimize the care of chronic pain patients. ,Founded 1996; Partnered 2007,A. Scott Walton,NA
Amplitude,https://amplitude.com/,Amplitude helps product teams rapidly build digital products that work better for the customer and grow their business.,Founded 2012; Partnered 2018,NA,Pat Grady; Sonya Huang
Amylin,http://www.amylin.com,Develops a line of diagnostic and therapeutic products for diabetics.,Founded 1987; Partnered 1990; IPO 1992,Howard E. Greene;  Jr.,NA
App Annie,http://www.appannie.com,"App Annie helps businesses do ""The Math Behind the App Stores"" with rankings; analytics; and market intelligence for all the leading app stores.",Founded 2010; Partnered 2013,Bertrand Schmitt,Omar Hamoui
Appirio,http://www.appirio.com,Appirio created a cloud-based platform that helps companies find new approaches to their business problems.,Founded 2006; Partnered 2008; Acquired 2016,Chris Barbin;  Narinder Singh;  Glenn Weinstein;  Michael O'Brien,Jim Goetz
Apple,http://www.apple.com,Apple revolutionized personal technology with the introduction of the Macintosh in 1984. Apple has repeatedly transformed the way humans interact with computers with the invention of the iPhone; iPod; MacBook; iMac; and more.,Founded 1976; Partnered 1978; IPO 1980,Steve Jobs;  Steve Wozniak,Donald Valentine
Arbor/Hyperion,http://www.hyperion.com,Developer of a flexible and powerful software engine that allows consolidation and manipulation of spreadsheets.,Founded 1981; Partnered 1991; IPO 1995,NA,Doug Leone
Armis,https://armis.com/,Armis is the first agentless; enterprise-class security platform to address the new threat landscape of unmanaged and IoT devices. Our mission is to let companies adopt these new types of connected devices without fear of compromise by cyber attack.,Founded 2015; Partnered 2015,Yevgeny Dibrov;  Nadir Izrael,Gili Raanan; Carl Eschenbach; Sonya Huang
Aruba,http://www.arubanetworks.com,Aruba designed Mobility-Defined Networks for large corporations.,Founded 2002; Partnered 2002; IPO 2007,Dominic P. Orr;  Pankaj Manglik;  Keerti Melkote,Doug Leone
Aspect Development,NA,Provides component information system software for electronics manufacturers.,Founded 1988; Partnered 1992; Acquired 2000; IPO 1996,Dr. Romesh Wadhwani,NA
Assurex Health,http://www.assurexhealth.com,Assurex Health helps physicians determine the right medication for patients; using pharmacogenomics—the study of the genetic factors that influence an individual's response to drug treatments.,Founded 2006; Partnered 2011; Acquired 2016,James S. Burns;  Gina Drosos;  Donald Wright,NA
Aster Data,http://www.asterdata.com,Fully embeds applications within database engine to enable ultra-fast; deep analysis of massive data sets.,Founded 2005; Partnered 2007; Acquired 2011,Tasso S. Argyros;  Mayank Bawa;  Quentin Gallivan,Doug Leone
Atari,https://twitter.com/atari,Founded in 1972; Atari is the original innovator of video gaming. It owns a portfolio of more than 200 games like Asteroids; Centipede and Pong. ,Founded 1972; Partnered 1975; Acquired 1976,Nolan Bushnell,Donald Valentine
Athelas,https://athelas.com/,Instant; at-home blood diagnostics for oncology care.,Founded 2016; Partnered 2016,Tanay Tandon;  Deepika Bodapati,Alfred Lin; Liu Jiang
Aurora,https://aurora.tech/,Aurora is catalyzing the self-driving revolution by solving today’s most complex AI; automation and engineering challenges.,Founded 2016; Partnered 2019,Chris Urmson;  Sterling Anderson;  Drew Bagnell,Carl Eschenbach; Amy Sun
Avanex,http://www.avanex.com,Producer of fiber optic-based photonic processors; which are designed to increase performance of optical networks.,Founded 1997; Partnered 1998; IPO 2000,Simon Cao PhD,NA
Barefoot Networks,http://barefootnetworks.com/,As Ethernet switch chips rise in demand; Barefoot Networks is innovating new ways to compete in the promising market by offering bare-metal switching to networking companies.,Founded 2013; Partnered 2014; Acquired 2019,Martin Izzard,Bill Coughran
Barracuda Networks,http://www.barracuda.com,Barracuda provides security; networking and storage solutions while improving application delivery and network access.,Founded 2003; Partnered 2005; IPO 2013,Dean Drako;  Michael Perone;  Zach Levow,Jim Goetz; Matthew Miller
bebop,https://www.bebop.co/,bebop builds and supports applications that enable people to seamlessly collaborate and accomplish complex tasks together.,Partnered 2015; Acquired 2015,Diane Greene,Jim Goetz
Berkeley Lights,https://www.berkeleylights.com/,Berkeley Lights has brought to market a novel technology for single cell identification; measurement and manipulation aiming to revolutionize biopharma; diagnostics and life science research.,Founded 2011; Partnered 2015,Eric Hobbs,Michael Moritz
Bird,https://www.bird.co/,"Bird is an electric vehicle sharing company dedicated to bringing affordable; environmentally-friendly transportation solutions to communities across the world. It provides a fleet of shared electric scooters that can be accessed via smartphones. Birds give people looking to take a short journey across town or down that ""last-mile"" from the subway or bus to their destination in a way that does not pollute the air or add to traffic. ",Founded 2017; Partnered 2018,Travis VanderZanden,Roelof Botha; Andrew Reed
Blue Danube Systems,http://www.bluedanubelabs.com,Blue Danube Systems designed a mobile wireless solution that significantly and cost-effectively increases network capacity and enhances quality of service. ,Founded 2006; Partnered 2013,Mark Pinto,Bill Coughran
BridgeBio,https://bridgebio.com/,BridgeBio finds; develops; and delivers breakthrough medicines for genetic diseases. They have built a portfolio of more than 15 transformative drugs ranging from pre-clinical to late stage development in multiple therapeutic areas including genetic dermatology; oncology; cardiology; neurology; endocrinology; renal disease; and ophthalmology. The company’s focus on scientific excellence and rapid execution aims to translate today's discoveries into tomorrow's medicines.,Founded 2014; Partnered 2018,Neil Kumar,Roelof Botha; Michael Dixon
Brud,http://www.http://www.brud.fyi,Brud is a transmedia studio that creates digital character driven story worlds.,Partnered 2016,Trevor McFedries;  Sara DeCou,Stephanie Zhan
Cafepress,http://www.cafepress.com,Allows people to create; buy; and sell personalized merchandise online using print-on-demand services that reflect their interests.,Founded 1999; Partnered 2005; IPO 2012,Fred Edward Durham III;  Maheesh Jain,Doug Leone
Carbon,http://carbon3d.com/,Through a process called “light extrusion;” Carbon is transforming 3D printing—moving beyond basic prototyping to 3D manufacturing and delivering previously impossible materials at over 100 times the speed. ,Founded 2013; Partnered 2013,Joe DeSimone;  Rob Schoeben;  Craig Carlson;  Alex Ermoshkin;  Jason Rolland,Jim Goetz
Carbon Black,https://www.carbonblack.com/,Carbon Black provides the most complete solution against attacks targeting organizations’ websites and servers; making it easier for companies to see and stop. ,Founded 2002; Partnered 2012; IPO 2018,Patrick Morley,Matthew Miller
CEGX,http://www.cambridge-epigenetix.com/,Cambridge Epigenetix (CEGX) aims to change the way medicine is practised by reducing several routine and important diagnostic screening tests to a simple blood draw using the power of epigenetics. Epigenetics is the way genes are switched on or off (“expressed”); without altering the genes themselves; due to the presence of small chemicals around DNA or its surrounding proteins.,Partnered 2015,Dr Jason Mellad,Roelof Botha
CenterRun Software,NA,CenterRun introduced a product that automates the configuration and deployment of web applications in enterprise data centers from a central console.,Founded 2000; Partnered 2001; Acquired 2003,Aaref Hilaly;  Mike Schroepfer;  Basil Hashem,Michael Moritz; Aaref Hilaly
Charlotte Tilbury,http://www.charlottetilbury.com/us/,Founded by world renown make-up artist Charlotte Tilbury; Charlotte Tilbury Beauty is revolutionizing make-up with easy to choose; easy to use and easy to gift skincare and color products.,Founded 2013; Partnered 2017,Charlotte Tilbury,Michael Moritz
Chartboost,http://www.chartboost.com,Founded by game developers and data geeks; Chartboost builds technology for people just like them; so they can turn their mobile games into successful businesses.,Founded 2011; Partnered 2012,Maria Alegre;  Sean Fannan,Jim Goetz; Michael Abramson
Cisco,http://www.cisco.com,Cisco was one of the first companies to sell commercially successful routers that support multiple network protocols.,Founded 1984; Partnered 1987; IPO 1990,Len Bosack;  Sandy Lerner,Donald Valentine
Citizen,http://www.citizen.com/,Citizen’s mission is to ‘Protect the World.’ Today; they do that through a free mobile application that keeps people safe and informed about local crime and incidents in their area.,Founded 2015; Partnered 2017,Andrew Frame;  JD Maresco;  Luis Samaniego,Mike Vernal
Clari,http://clari.com/,Clari makes selling just about anything easier by combining data science; advanced analytics; mobile and cloud technology.,Founded 2012; Partnered 2012,Venkat P Rangan;  Andy Byrne,Aaref Hilaly
Clearwell Systems,http://www.symantec.com/theme.jsp?themeid=clearwell-family,Clearwell Systems changed the way companies perform electronic discovery in response to litigation; regulatory inquiries; and internal investigations.,Founded 2004; Partnered 2005; Acquired 2011,Aaref Hilaly;  Venkat P Rangan;  Charu Rudrakshi,Jim Goetz; Aaref Hilaly
Clever,http://clever.com,Schools call Clever a game changer because it makes using a school's technology faster and simpler for teachers and students.,Founded 2012; Partnered 2013,Tyler Bosmeny;  Dan Carroll;  Rafael Garcia,Bryan Schreier
Clickatell,http://www.clickatell.com,In 2000; Clickatell was founded to address a need in South Africa for an SMS provider that could enable the sending of multiple texts to different countries from a single website.,Founded 2000; Partnered 2007,Pieter De Villiers;  Casper De Villiers;  Patrick Lawson,NA
Clover Health,https://cloverhealth.com/,Clover Health is a unique health insurance plan focused on driving down costs and producing improved health outcomes. Clover uses sophisticated analytics and custom software to direct their own clinical staff to proactively fill in gaps in the care of their members. Clover has a proven model they're scaling out.,Founded 2014; Partnered 2015,Vivek Garipalli;  Kris Gale,Michael Dixon
Clutter,https://www.clutter.io,Clutter helps relieve stress from major life events. The company's full-service storage service allows consumers to safely and affordably store their belongings without lifting a finger.,Founded 2013; Partnered 2015,Ari Mir;  Brian Thomas,Omar Hamoui
Cobalt Robotics,https://cobaltrobotics.com/,Cobalt’s Security Service combines advances in autonomous cars; machine learning; anomaly detection; and 2-way telepresence. This allows a remote guard to be in many locations at once— providing high-level human intelligence; rapid situational awareness; real-time responsiveness; and perfect accountability.,Founded 2016; Partnered 2018,Travis Deyle;  Erik Schluntz,Alfred Lin
Cohesity,http://www.cohesity.com/,Cohesity is in the business of building and selling the next generation of secondary storage appliances.,Founded 2013; Partnered 2013,Mohit Aron,Bill Coughran; Carl Eschenbach
Comprehend,http://www.comprehend.com,Comprehend Systems creates SaaS tools that help understand; explore; and analyze data across multiple; disparate data sources. Comprehend Systems' first product; Comprehend Clinical; was created to improve and accelerate clinical trials to bring new; safer treatments to market sooner.,Founded 2010; Partnered 2013,Rick Morrison;  Jud Gardner,Michael Dixon
Confluent,https://www.confluent.io/,Confluent was founded by the team that built Apache Kafka™ at LinkedIn and that scaled Kafka to accommodate over 1 trillion messages per day – covering everything happening in a company.,Founded 2014; Partnered 2017,Jay Kreps;  Neha Narkhede;  Jun Rao,Matthew Miller
Cortexyme,https://www.cortexyme.com/,Cortexyme is a clinical stage pharmaceutical company developing small molecules to alter the course of Alzheimer’s and other degenerative disorders. Cortexyme is targeting a specific; undisclosed infectious pathogen tied to neurodegeneration and chronic inflammation in humans and animal models. The company’s lead compound; COR388; is the subject of an ongoing phase 1b clinical development program. Additional proprietary small molecules are moving forward in preclinical development. ,Founded 2012; Partnered 2018; IPO 2019,Casey Lynch;  Steve Dominy;  MD;  Kristen Gafric;  JD,Michael Dixon
Crew,https://crewapp.com/,Crew is a messaging app that's geared towards workers who don't sit in front of a computer for work. Similar to how Slack has helped workers in the information economy; Crew provides a single way for employees and managers to communicate using the phones they already have. ,Founded 2015; Partnered 2016,Daniel Leffel;  Broc Miramontes,NA
Cumulus Networks,http://www.cumulusnetworks.com,Cumulus Networks enables high-capacity networks and architectures that are affordable and easy to deploy.,Founded 2009; Partnered 2013,JR Rivers;  Nolan Leake,NA
Cypress,http://www.cypress.com,Develops advanced process-CMOS-integrated circuits for microprocessors and microcontrollers.,Founded 1982; Partnered 1983; IPO 1986,TJ Rodgers,NA
Dashlane,https://www.dashlane.com/,Dashlane simplifies and secures your digital identity across all platforms and devices. The Dashlane app automatically fills and stores passwords; personal data; and payment details and includes a suite of tools to help you manage; monitor; and protect your digital identity. Available in 11 languages and trusted by 11+ million people in 180 countries; it's the complete; global solution for living safely and seamlessly online.,Founded 2009; Partnered 2019,Emmanuel Schalit;  Guillaume Maron;  Jean Guillou,Jim Goetz; Sonya Huang
Decolar,http://www.decolar.com,Decolar was the first site in Brazil to offer a single digital destination for flights; hotels; car and property rentals; amusement park passes and travel packages.,Founded 1999; Partnered 2011; IPO 2017,Roberto Souviron,Michael Abramson
Dia&Co,https://www.dia.com/,Dia&Co an online shopping experience for women who wear size 14+. The company's flagship product is a personal styling service that allows customers to shop from the comfort of their homes. By developing a new kind of relationship with customers; Dia is resolving decades of inefficiencies in plus-size shopping. ,Founded 2014; Partnered 2016,Nadia Boujarwah;  Lydia Gilbert,Alfred Lin; Jess Lee
Docker,http://www.docker.com,Docker is pioneering the “containerization” of apps within the enterprise. It is built on an open source platform for developers of distributed applications.,Founded 2010; Partnered 2014,Ben Golub;  Solomon Hykes,Matthew Miller; Bill Coughran
Domino Data Lab,https://www.dominodatalab.com/,Domino was founded by three veterans of the finance industry; to help leading organizations develop better medicines; grow more productive crops; build better cars; or simply recommend the best song to play next. Their mission is to help data scientists across industries develop and deploy ideas faster with collaborative; reusable; reproducible analysis.,Founded 2016; Partnered 2016,Nick Elprin; Chris Yang; Matthew Granade,Bryan Schreier
DoorDash,http://www.doordash.com,Founded in 2013 in a dorm room at Stanford; DoorDash began with a mission to deliver local products to people online.,Founded 2013; Partnered 2014,Tony Xu;  Stanley Tang;  Andy Fang,Alfred Lin; Michael Abramson
Drawbridge,http://drawbridge.com/,Drawbridge is the leader in identity resolution that helps customer-obsessed companies connect; unify; and supercharge their data to deliver unparalleled experiences with unmatched clarity. Drawbridge uses large-scale AI and machine learning technologies to build democratized solutions for identity to power martech; customer experience; and security applications.,Founded 2010; Partnered 2010; Acquired 2019,Kamakshi Sivaramakrishnan,Jim Goetz
Drift,https://www.drift.com/,Drift is the world’s leading conversational marketing platform. ,Founded 2014; Partnered 2017,David Cancel;  Elias Torres,Pat Grady
Dropbox,http://www.dropbox.com,In 2007 there was nothing like Dropbox. Internet users emailed themselves photos; docs and videos; or saved them to thumb drives. ,Founded 2007; Partnered 2007; IPO 2018,Drew Houston;  Arash Ferdowsi,Bryan Schreier
Druva,http://www.druva.com/,Druva is a leading provider of continuous data protection and disaster recovery solutions.,Founded 2007; Partnered 2010,Jaspreet Singh,Shailendra Singh
Electronic Arts,http://www.ea.com,Electronic Arts was a pioneer of the early home computer games industry and was notable for promoting the designers and programmers responsible for its games.,Founded 1982; Partnered 1982; IPO 1989,Trip Hawkins;  John Riccitiello,Donald Valentine
Elevate,http://elevateapp.com,Elevate is a new type of cognitive training tool designed to build communication and analytical skills. ,Founded 2014; Partnered 2012,Jesse Pickard,Bryan Schreier
Elevate Credit,http://www.elevate.com/,Elevate's products deliver new levels of access; convenience and value to those who need it most.,Founded 2014; Partnered 2005; IPO 2017,Kenneth Rees,Pat Grady
Embark Trucks,https://embarktrucks.com/,Embark Trucks is developing self-driving semi trucks. Their team is made up of robotics specialists with deep expertise in artificial intelligence; machine learning; and real-world deployment of advanced technology. Embark Trucks' autonomous fleet leverages this leading technology to help address rising shipping costs due to the shortage of drivers for long-haul trips. ,Founded 2016; Partnered 2018,Alex Rodrigues;  Brandon Moak,Pat Grady
EndoChoice,http://www.endochoice.com,Founded in 2008; EndoChoice manufactures and sells technology systems; products; devices and services to specialists treating a wide range of gastrointestinal conditions. ,Founded 2007; Partnered 2013,Mark Gilreath,Michael Dixon; Yoav Shaked
Ethos,https://www.getethos.com/,Ethos is a next generation life insurance company that transforms the policy-buying experience by making it self-serve and instantaneous; whether online or on mobile.,Founded 2016; Partnered 2017,Peter Colis;  Lingke Wang,Roelof Botha; Stephanie Zhan
Eventbrite,http://www.eventbrite.com,Eventbrite was the first site that allowed anyone to find; create and manage an event.,Founded 2006; Partnered 2009; IPO 2018,Kevin Hartz;  Julia Hartz;  Renaud Visage,Roelof Botha
Evernote,http://www.evernote.com,Evernote brings your life's work together in one digital workspace for storing and sharing. As one workspace that lives across your phone; tablet; and computer; Evernote is the place you write free from distraction; collect information; find what you need; and present your ideas to the world. ,Founded 2007; Partnered 2010,Phil Libin;  Chris O'Neill;  Stepan Pachikov,Roelof Botha
Everwise,https://www.geteverwise.com/,Everwise exists to solve an acute challenge – providing highly motivated professionals with the opportunities they uniquely need to be successful throughout their careers.,Founded 2013; Partnered 2015,Ian Gover;  Colin Schiller;  Michael Bergelson,NA
Faire,https://www.faire.com/,Faire is revolutionizing the way retailers shop for their stores by taking all the pain out of the buying process. Store owners can come to Faire to get product recommendations from hundreds of brands all in one place.,Founded 2016; Partnered 2017,Max Rhodes;  Daniel Perito;  Marcel Cortes,Alfred Lin
Figma,https://www.figma.com/,Figma is the first web-based collaborative design tool. Multiple people can jump in a file at the same time; so they can design; prototype; copy code and gather feedback all in one place. Figma has simplified the design process for teams of designers; developers; product managers; marketers and others at thousands of companies including Uber; Square; Twitter and GitHub.,Founded 2012; Partnered 2019,Dylan Field;  Evan Wallace,Andrew Reed
FireEye,http://www.fireeye.com,Founded in 2004; FireEye brought a fresh perspective to network security and malware protection by using a virtual-machine-based security platform rather than slow; physical machines. ,Founded 2004; Partnered 2004; IPO 2013,David G. DeWalt;  Ashar Aziz,Bill Coughran
First Republic Bank,http://www.firstrepublic.com,Provides private banking; private-business banking; real-estate lending and wealth-management services.,Founded 1985; Partnered 2010; IPO 2010,James Herbert,Michael Moritz; Pat Grady
Flex,http://www.flextronics.com,Provides contract-manufacturing services to equipment manufacturers.,Founded 1969; Partnered 1993; IPO 1994,Mike McNamara,Michael Moritz
