name,url,description,milestones,team,partner
Front,https://frontapp.com/,Front redefines work communication with the first shared inbox for teams. By unifying email; customer communication channels; and apps in one delightful platform; Front helps teams collaborate transparently; and work faster and better together.,Founded 2013; Partnered 2017,Mathilde Collin;  Laurent Perrin,Bryan Schreier; Andrew Reed
FutureAdvisor,https://futureadvisor.com,FutureAdvisor developed a smarter way to manage your stock portfolio. Through its free software; wealth management consultation is now accessible to anyone with a computer.,Founded 2010; Partnered 2010; Acquired 2015,Jon Xu;  Bo Lu,Alfred Lin
GameFly,http://gamefly.com,GameFly uses a monthly subscription model for game consoles and handhelds that saves gamers the hassle of finding and playing games that don't appeal to them. ,Founded 2002; Partnered 2002,Sean Spector;  Dave Hodess,Michael Moritz
GenEdit,http://www.genedit.com/,GenEdit was founded to transform the delivery of gene therapies and enable the next generation of non-viral; gene editing-based therapeutics. GenEdit’s technology platform solves current delivery challenges by systematically screening its proprietary nanoparticle library and providing safer and efficient delivery to target tissues. GenEdit’s proprietary nanoparticles has broad applicability including the development of CRISPR-based therapeutics and gene therapy products for a wide range of genetic diseases.,Founded 2016; Partnered 2016,Kunwoo Lee;  Hyo Min Park;  Niren Murthy,Roelof Botha
GitHub,https://www.github.com,GitHub has built the system of record for code and has emerged as the de facto standard for software development in today’s world.,Founded 2008; Partnered 2015; Acquired 2018,Chris Wanstrath;  PJ Hyett,Jim Goetz; Andrew Reed
Glossier,https://www.glossier.com/,Founded in 2014; Glossier Inc. is building the future beauty company in collaboration with its customers. With products inspired by the people who use them and a mission to give voice through beauty; Glossier celebrates individuality and personal choice.,Founded 2014; Partnered 2019,Emily Weiss,Michael Abramson; Sonya Huang
Good Eggs,http://www.goodeggs.com,Good Eggs makes it easy for busy people to eat well at home by curating a marketplace full of the best local; organic produce; sustainable meat and fish; and delicious grocery staples.,Founded 2011; Partnered 2013,Bentley Hall;  Alon Salant,Bryan Schreier
Google,http://www.google.com,Google’s founders Larry and Sergey sought to organize the world’s information; and make it universally accessible and useful. The result is Google Search; the world’s most popular way to find information on the web.,Founded 1998; Partnered 1999; IPO 2004,Sergey Brin;  Larry Page,Michael Moritz
Graphcore,https://www.graphcore.ai/,Graphcore has designed a new processor specifically for machine learning - the intelligence processing unit (IPU) to let innovators create next generation machine intelligence.,Founded 2016; Partnered 2017,Nigel Toon;  Simon Knowles,Matthew Miller; Bill Coughran; Stephanie Zhan
Green Dot,https://www.greendot.com/greendot,Largest issuer of reloadable prepaid VISA and MasterCard debit cards.,Founded 1999; Partnered 2003; IPO 2010,Steve Streit,Michael Moritz
Guardant Health,http://www.guardanthealth.com,Guardant Health is a leading precision oncology company focused on helping conquer cancer globally through use its proprietary blood tests; vast data sets and advanced analytics. ,Founded 2012; Partnered 2013; IPO 2018,Helmy Eltoukhy;  AmirAli H. Talasaz;  Michael Wiley,Aaref Hilaly
Hayneedle,http://www.hayneedle.com,A collection of online stores that offers the largest selection of great specialty products at prices that fit within most any budget. Starting out as hammocks.com; Hayneedle has grown to become the one of the world’s largest home furnishings online retailers. ,Founded 2002; Partnered 2006,Doug Nielsen;  Mark Hasebroock,NA
Health Catalyst,http://www.healthcatalyst.com,Health Catalyst redefined analytics for hospitals and how they handle data unique to medicine. By determining normal data modeling was not the best fit for medical offices; Health Catalyst identified a crucial starting point for improving healthcare.,Founded 2008; Partnered 2011,Daniel Burton;  Steve Barlow;  Brent Dover,Michael Dixon
Hearsay Systems,https://hearsaysystems.com,Hearsay helps modernize traditional sales organizations by getting them tuned into social media. ,Founded 2009; Partnered 2010,Clara Shih;  Steve Garrity,Bryan Schreier
HireVue,http://www.hirevue.com,HireVue provides a video intelligence platform that utilizes video interviewing and pre-hire assessment to help global enterprises gain a competitive advantage in the modern talent marketplace to deliver a transformational hiring process.,Founded 2004; Partnered 2013,Kevin Parker;  Loren Larsen,Matthew Miller
Houseparty,https://joinhouse.party/,Houseparty allows users to quickly jump into “parties” of up to 8 people simultaneously; creating drop-in-drop-out style video chats between any friends who are online at the same time.,Founded 2012; Partnered 2016; Acquired 2019,Ben Rubin;  Itai Danino;  Sima Sistani,Mike Vernal
Houzz,http://www.houzz.com,A marketplace of homeowners and home professionals; Houzz is the best way to get inspired; discover products and to find and collaborate with the perfect architect; designer or contractor.,Founded 2009; Partnered 2011,Adi Tatarko;  Alon Cohen,Alfred Lin
HubSpot,http://www.hubspot.com,HubSpot does away with the needle-in-the-haystack approach to targeting consumers; allowing companies to manage the vast variety of marketing tools with one centralized system.,Founded 2006; Partnered 2011; IPO 2014,Brian Halligan;  Dharmesh Shah,Pat Grady; Jim Goetz
Humble Bundle,http://www.humblebundle.com,Using a pay-what-you-will model; Humble Bundle offers content to gamers while helping indie developers and charities.,Founded 2010; Partnered 2011,Jeff Rosen;  John Graham,Alfred Lin
Infoblox,http://www.infoblox.com,Delivers Automated Network Control; the fundamental technology that connects end users; devices and networks.,Founded 1999; Partnered 2003; IPO 2012,Robert Thomas;  Stuart Bailey,NA
Inkling,http://www.inkling.com,Inkling is on a mission to transform the way people work. Founded in 2009; Inkling’s mobile platform brings policies and procedures to life for the deskless worker. Employees today expect to go online to find accurate and compelling information on how to do their job; yet employers still ship paper binders or static PDF and Word files. Enterprises use Inkling to deliver policies and procedures in the form of dynamic documents. These documents behave more like consumer apps and engage the user with videos; interactive simulations; dynamic forms and checklists. Employees rely on Inkling to deliver exceptional customer experiences.,Founded 2009; Partnered 2010,Matt MacInnis;  Rob Cromwell,Bryan Schreier
INS,http://www.ins.com,Solved networking issues created by customer implementations of multi-vendor and multi-protocol network solutions.,Founded 1993; Partnered 1993; Acquired 1999; IPO 1996,NA,Doug Leone; Jim Goetz
Inside.com,http://www.inside.com/,Inside.com changes the way we read news on mobile devices by offering a short; engaging jump-off point into a curated feed of timely articles from reputable publications.,Founded 2007; Partnered 2006,Jason Calacanis,Roelof Botha
Instacart,http://instacart.com,Instacart seeks to build the best way for people anywhere in the world to shop for groceries and have them delivered instantly.,Founded 2012; Partnered 2013,Apoorva Mehta;  Max Mullen;  Brandon Leonardo,Michael Moritz; Alfred Lin; Michael Abramson
Instagram,http://instagram.com,Instagram changed the way we share photos and video with our mobile devices. By packaging easy-to-use photo editing with social media; the company has improved the quality of photography the world over.,Founded 2010; Partnered 2012; Acquired 2012,Kevin Systrom;  Mike Krieger,Roelof Botha; Michael Abramson
IPG,http://www.ipg.com/,IPG collaborates with health plans in partnership with providers; physicians; manufacturers and patients to develop market-based solutions that deliver tangible value in the implantable Device Benefit Management space.,Founded 2004; Partnered 2010,Vince Coppola,Michael Dixon
Ironclad,https://ironcladapp.com/,Ironclad builds contract solutions for creating; automating and tracking contracts; empowering legal teams to do more legal work; less paperwork. ,Founded 2014; Partnered 2018,Jason Boehmig;  Cai GoGwilt,Jess Lee
Isilon Systems,http://www.isilon.com,Develops clustered storage systems in data-intensive markets.,Founded 2001; Partnered 2002; Acquired 2010; IPO 2006,Sujal Patel;  Paul Mikesell,NA
Jasper,https://www.jasper.com,Jasper is a global Internet of Things (IoT) platform. Its SaaS IoT platform enables companies to rapidly and cost-effectively launch; manage; and monetize IoT services on a global scale. ,Founded 2004; Partnered 2005; Acquired 2016,Jahangir Mohammed;  Daniel Collins;  Amit Gupta,Omar Hamoui; Jim Goetz
Jawbone,http://www.jawbone.com,A pioneer in Bluetooth technology; Jawbone makes discreet; wireless wearable devices.,Founded 1999; Partnered 2007,Hosain Rahman;  Alex Asseily,NA
Jive,http://www.jivesoftware.com,Jive has encouraged and enabled enterprises to communicate and collaborate through its pioneering social business software platform.,Founded 2001; Partnered 2007; IPO 2011,Bill Lynch;  Matt Tucker,Jim Goetz; Pat Grady
Kahuna,http://www.usekahuna.com/,Kahuna invented the world’s first customer engagement engine dedicated to targeting and delighting customers of all demographics.,Founded 2012; Partnered 2014,Adam Marchick;  Jacob Taylor,Omar Hamoui
KAYAK,http://www.kayak.com,By consolidating search functions for hundreds of travel companies; KAYAK became a one-stop site for booking plane tickets; hotels; cars and travel packages.,Founded 2004; Partnered 2005; Acquired 2013; IPO 2012,Steve Hafner;  Paul English,Michael Moritz
Kenshoo,http://www.kenshoo.com,Kenshoo is the global leader in agile marketing; developing award-winning technology that powers digital marketing campaigns for nearly half of the Fortune 50 and all 10 top global ad agency networks. ,Founded 2006; Partnered 2007,Yoav Izhar-Prato;  Alon Sheafer;  Nir Cohen,Shmil Levy
Kiwi,http://www.kiwiup.com,Kiwi saw a gap in the amount of games being developed for Android as an opportunity to excel and create entertainment apps built for the entire gaming market.,Founded 2011; Partnered 2011,Omar Siddiqui;  Shvetank Jain,Alfred Lin; Omar Hamoui
Klarna,http://www.klarna.com,Klarna gives customers the simplest buying experience and companies amazing checkout rates.,Founded 2005; Partnered 2010,Sebastian Siemiatkowski;  Victor Jacobsson;  Niklas Adalberth,Michael Moritz; Michael Abramson
Lattice Engines,http://www.lattice-engines.com,Lattice is pioneering predictive marketing through intelligent applications and highly specific campaign options that make complex data science easy to use.,Founded 2005; Partnered 2011,Shashi Upadhyay,Doug Leone
Lifecode,http://lifecodehealth.com/,Starting with an oncology focus; Lifecode is committed to improving the lives of patients through interpretation and architecture of genomic medicine.,Founded 2011; Partnered 2011,NA,NA
LightStep,http://lightstep.com/,LightStep is rethinking observability in the emerging world of microservices and high concurrency. LightStep's first product enables developers and devops to trace individual requests through complex systems with incredibly high fidelity.,Founded 2015; Partnered 2017,Ben Sigelman;  Ben Cronin;  Daniel Spoonhower,Aaref Hilaly
Lilt,https://lilt.com/,Lilt helps companies be first to emerging markets by offering a complete; high-quality solution for enterprise translation. By offering the first machine translation engine that continuously learns from human feedback; Lilt helps enterprises increase translation quality and speed without spiking costs.,Founded 2015,Spence Green;  John DeNero,Bill Coughran; Liu Jiang
Limbix,https://www.limbix.com/,Limbix provides Virtual Reality and digital therapeutic tools to help therapists provide more effective mental healthcare.,Founded 2016; Partnered 2016,Ben Lewis;  Tony Hsieh,NA
Linear Technology,http://www.linear.com,Manufacturer of analog-integrated circuits.,Founded 1981; Partnered 1981; IPO 1986,Bob Swanson,Donald Valentine
LinkedIn,http://www.linkedin.com,In 2003; LinkedIn launched the social network for professionals; allowing people to connect based on business interactions.,Founded 2002; Partnered 2003; IPO 2011,Reid Hoffman;  Jeff Weiner,Michael Moritz
LitePoint,http://www.litepoint.com,Tests and analyzes wireless devices through development and manufacturing phases.,Founded 2000; Partnered 2007; Acquired 2011,Spiros Bouas;  Benny Madsen;  Christian Olgaard,NA
LSI Logic,http://www.lsilogic.com,Founded in 1981; LSI Logic created advanced custom semiconductors and software to help companies store and distribute their data more efficiently between data centers; mobile networks and client computers.,Founded 1981; Partnered 1981; IPO 1983,Wilf Corrigan;  Abhi Y. Talwalkar,Donald Valentine
Luminate,http://www.luminatewireless.com/,Luminate enables mobile operators by transforming the ways in which they create networks and services.,Founded 2013; Partnered 2013,Murari Srinivasan;  Kevin Yu,Bill Coughran
Mapillary,https://www.mapillary.com/,Mapillary is a passionate community of people who want to make the world accessible to everyone by creating a photo representation of the world. Anyone can join the community and collect street level photos by using simple tools like smartphones or action cameras.,Founded 2013; Partnered 2014,Jan Erik Solem,Roelof Botha
MarkLogic,http://www.marklogic.com,Due to the increasing demands of housing big data; MarkLogic provides solutions by offering flexible and extensive databases for enterprises that are easy to integrate; search and manage.,Founded 2001; Partnered 2002,Christopher Lindblad;  Gary L. Bloom,Pat Grady
Maven,https://www.mavenclinic.com/,"Maven is the only virtual clinic dedicated to women’s and family health. Maven’s platform gives on-demand access to best-in-class women’s and family health specialists; and makes it affordable and easy to get advice; diagnoses; and even prescriptions via video appointments; private messaging; and community-based forums.
Maven operates both an on-demand consumer marketplace in addition to its family benefits platform; which offers programs around fertility; adoption; maternity; and return-to-work. ",Founded 2014; Partnered 2018,Kate Ryder,Jess Lee
Medallia,http://www.medallia.com,Medallia's vision is simple: to create a world where companies are loved by customers and employees alike. Medallia Experience Cloud embeds the pulse of the customer in the organization and empowers employees with the customer data; insights and tools they need to make every experience great. More than 1;000 global brands trust Medallia's SaaS platform; the only enterprise grade platform that can wire the entire organization to systematically drive action and win on customer experience. Medallia has offices in Silicon Valley; New York; London; Paris; Sydney; Buenos Aires; and Tel Aviv.,Founded 2001; Partnered 2011,Leslie Stretch;  Amy Pressman;  Borge Hald,Doug Leone; Pat Grady
MedExpress,http://www.medexpress.com,The mission of MedExpress is to provide a one-stop urgent-care option for unscheduled; timely treatment that isn't quite ER-serious.,Founded 2001; Partnered 2010; Acquired 2015,Frank Alderman,Doug Leone; Michael Dixon
Mellanox,http://www.mellanox.com,Provider of Ethernet and InfiniBand network switches and host bus adapters.,Founded 1999; Partnered 1999; IPO 2007,Eyal Waldman,NA
Meraki,http://www.meraki.com,Meraki offered a complete system of networking products; doing away with market fragmentation; and allowing companies to utilize network connections of the highest speed and quality.,Founded 2006; Partnered 2006; Acquired 2012,Sanjit Biswas;  John Bicket;  Hans Robertson,Doug Leone
Merlin Securities,,Provided prime brokerage software and services to the alternative-investment community.,Founded 2004; Partnered 2007; Acquired 2012,Stephan Vermut;  Aaron Vermut,Pat Grady
Metanautix,http://metanautix.com,Metanautix created the first data compute engine of its kind; helping companies drill down into complex data across various sources; and visualize it in a way that is easily extractable; regardless of differences in network; structure; format or location.,Founded 2012; Partnered 2012; Acquired 2016,Theo Vassilakis,Bill Coughran
MetaStable,http://metastablecapital.com/,Meta Stable is the first broad-spectrum crypto currency investment fund.,Founded 2014; Partnered 2017,Naval Ravikant;  Joshua Seims;  Lucas Ryan,NA
Metaswitch Networks,http://www.metaswitch.com,Metaswitch is the world’s leading cloud native communications software company. The company develops commercial and open-source software solutions that are constructively disrupting the way that service providers build; scale; innovate and account for communication services. By working with Metaswitch; visionary service providers are realizing the full economic; operational and technology benefits of becoming cloud-based and software-centric. Metaswitch’s award-winning solutions are powering more than 1;000 service providers in today’s global; ultra-competitive and rapidly changing communications marketplace.,Founded 1981; Partnered 2008,Martin Lund,Jim Goetz; Pat Grady
Microchip Technology,http://www.microchip.com,Manufacturer of microcontroller; memory; and analog semiconductors.,Founded 1987; Partnered 1989; IPO 1993,Steve Sanghi,Donald Valentine
Mira Labs,https://www.mirareality.com/,Mira Labs is a mobile augmented reality company with a mission to enhance the way we interact with technology and each other— starting in the workplace. Their minimalist; untethered AR headset works seamlessly with smartphones to allow users to engage in AR applications without the traditionally high barriers to entry.,Founded 2016; Partnered 2017,Ben Taft;  Matt Stern;  Montana Reed,Omar Hamoui
MobileIron,http://www.mobileiron.com,Through a comprehensive line of mobile apps; MobileIron lets IT administrators manage content on mobile devices across a network.,Founded 2007; Partnered 2008; IPO 2014,Bob Tinker;  Suresh Batchu;  Ajay Mishra,Aaref Hilaly
MongoDB,http://www.mongodb.com/,MongoDB is the leading modern; general purpose database platform; designed to unleash the power of software and data for developers and the applications they build.,Founded 2007; Partnered 2010,Eliot Horowitz;  Dev Ittycheria;  Dwight Merriman,Roelof Botha
Moovit,http://www.moovitapp.com,Moovit is the world's largest urban mobility data and analytics company and the #1 transit app. Moovit simplifies your urban mobility all around the world; making getting around town via transit easier and more convenient. By combining information from public transit operators and authorities with live information from the user community; Moovit offers travelers a real-time picture; including the best route for the journey. ,Founded 2011; Partnered 2013,Nir Erez;  Roy Bick,Gili Raanan; Alfred Lin
Mu Sigma,http://www.mu-sigma.com,Mu Sigma provides decision sciences and analytics services to help companies institutionalize data-driven decision making.,Founded 2005; Partnered 2011,Dhiraj C. Rajaram,Shailendra Singh
Namely,http://www.namely.com,Namely provides a SaaS HR platform for mid-market companies. ,Founded 2012; Partnered 2015,Elisa Steele;  Graham Younger;  Paul Rogers;  & Dan Murphy,Pat Grady; Andrew Reed
Natera,http://www.natera.com,Natera is a genetic testing and diagnostics company that seeks to transform the management of genetic disease through proprietary bioinformatics and molecular technology.,Founded 2004; Partnered 2007,Matthew Rabinowitz;  Jonathan Sheena,Roelof Botha
NetApp,http://www.netapp.com,Computer storage and network data management company.,Founded 1992; Partnered 1994; IPO 1995,Daniel J. Warmenhoven;  David Hitz;  James Lau,Donald Valentine
Netezza,http://www.netezza.com,Simplifies high-performance analytics for business users.,Founded 2000; Partnered 2003; IPO 2007,Jit Saxena,Doug Leone
NetScreen,NA,Offers network/internet security solutions that integrate firewall; VPN encryption and traffic management on a single platform.,Founded 1998; Partnered 1998; Acquired 2004; IPO 2001,Feng Deng;  Yan Ke,NA
NEXT Trucking,https://www.nexttrucking.com/,NEXT Trucking is transforming the $700 billion trucking industry by connecting verified truckers to prescreened shippers through an efficient and transparent online marketplace that utilizes predictive load offering technology and intelligent matching capabilities to factor in preferred routes; rates and additional key touch points.,Founded 2015; Partnered 2017,Lidia Yan;  Elton Chung,NA
Nimble,https://www.nimblerx.com/,Nimble is building the largest; most convenient pharmacy in the world. Nimble is a pharmacy platform that enables prescriptions to be delivered the same day as prescribed to patients.,Founded 2014; Partnered 2015,Talha Sattar,Aaref Hilaly
Nimble Storage,http://www.nimblestorage.com,Complex infrastructure creates an app-data gap that disrupts data delivery. Closing the app-data gap requires predicting and preventing barriers to data velocity.,Founded 2008; Partnered 2008; IPO 2013,Suresh Vasudevan;  Umesh Maheshwari;  Varun Mehta,Jim Goetz; Matthew Miller
Noom,https://www.noom.com/#/,Noom is the behavior change company that's disrupting the wellness industry; providing mobile; psychology-based behavior change programs to help people lose weight and prevent or manage conditions like diabetes and hypertension.,Founded 2008; Partnered 2019,Saeju Jeong;  Artem Petakov,Michael Abramson; Amy Sun
Nubank,http://www.nubank.com.br,With its efficient; transparent; mobile-first approach; Nubank is redefining people’s relationships with money via simple; accessible credit cards and digital banking.,Founded 2013; Partnered 2013,David Vélez;  Edward Wible;  Cristina Junqueira,Doug Leone; Michael Abramson
Numerify,http://www.numerify.com,Numerify gives companies powerful cloud-based tools to get an unprecedented total view into operational and financial performance; while allowing IT to attain a more compelling front-office presence.,Founded 2012; Partnered 2014,Gaurav Rewari;  Srikant Gokulnatha;  Sadanand Sahasrabudhe;  Pawan Rewari,Doug Leone
NVIDIA,http://www.nvidia.com,NVIDIA pioneered the art and science of visual computing. Its invention of the GPU transformed the PC from a tool for productivity into one for creativity and discovery.,Founded 1993; Partnered 1993; IPO 1999,Jen-Hsun Huang,NA
Okta,http://www.okta.com,Okta is the foundation for secure connections between people and technology. By harnessing the power of the cloud; Okta allows people to access applications on any device at any time; while still enforcing strong security protections. It integrates directly with an organization’s existing directories and identity systems; as well as 4;000+ applications. Because Okta runs on an integrated platform; organizations can implement the service quickly at large scale and low total cost.,Founded 2009; Partnered 2012; IPO 2017,Todd McKinnon;  Freddy Kerrest,Pat Grady; Matthew Miller
Onyx Pharmaceuticals,,Biopharmaceutical company engaged in the development and commercialization of innovative therapies for cancer patients.,Founded 1992; Partnered 1993; IPO 1996,Frank McCormick,NA
OpenDNS,http://www.opendns.com,OpenDNS is the world’s largest cloud-delivered security platform serving more than 65 million daily users across 160+ countries. Providing a new layer of protection both on and off a company’s network; OpenDNS prevents malicious attacks over any port or protocol. ,Founded 2006; Partnered 2009,David Ulevitch,Pat Grady
Oracle,http://www.oracle.com,For decades; Oracle has engineered integrated hardware and software systems for business; uniting a disjointed digital landscape and creating solutions for the largest companies in the world.,Founded 1977; Partnered 1983; IPO 1986,Larry Ellison,Donald Valentine
Orbital Insight,http://www.orbitalinsight.com,Through a technique called deep learning; Orbital Insight harnesses and analyzes satellite imagery; enabling innovation in everything from agricultural development to deforestation policy. ,Founded 2013; Partnered 2014,James Crawford,Bill Coughran; Andrew Reed
Orchid Labs,https://www.orchid.com/,Orchid Labs Inc. is an open-source project committed to ending surveillance and censorship on the internet. The Orchid protocol uses an overlay network built upon the existing internet; which is driven by a peer-to-peer tokenized bandwidth exchange; creating a more inclusive; liberated internet. Orchid Labs was founded in 2017 by Stephen Bell; Brian J. Fox; Gustav Simonsson; Dr. Steven Waterhouse; and Jay Freeman. Orchid Labs is headquartered in San Francisco; California.,Founded 2017; Partnered 2017,Stephen​ ​Bell;  Brian Fox;  Jay Freeman;  Gustav Simonsson;  Dr. Steven Waterhouse,NA
Palo Alto Networks,http://www.paloaltonetworks.com,Frustrated with the slow progress of ideas at his employer; Nir Zuk founded Palo Alto Networks to introduce new ways to protect enterprise; government and service providers through better firewalls and stronger network security.,Founded 2005; Partnered 2005; IPO 2012,Nir Zuk;  Rajiv Batra;  Mark McLaughlin,Jim Goetz; Carl Eschenbach
